2,,,3913432,"Metropolitan map Ottawa and vicinity ; Carte metropolitaine ville de Québec, 1933",Metropolitan map Ottawa and vicinity ; Carte metropolitaine ville de Québec,eng fre,,1933,,,,,,,,,,,,,,,,165,,#1,,,,,,Shell metropolitan map Ottawa and Quebec,,,H.M. Gousha Company,,,,,,eng,,,,,,,,,,,,,,,,,
2,,,3913199,"Metropolitan Montreal, 1955",Metropolitan Montreal,eng fre,,1955,,,,,,,,,,,,,,,,226,,#1,,,,,,Metropolitan Montreal and Quebec,,,Rolph-Clark-Stone Limited.,,,,,,eng,,,,,,,,,,,,,,,,,
2,,,3913435,"Metropolitan Ottawa and vicinity ; Carte métropolitain ville de Québec, [between 1940 and 1949?]",Metropolitan Ottawa and vicinity ; Carte métropolitain ville de Québec,eng fre,[between 1940 and 1949?],,,,,,,,,,,,,,,,,165,,#1,,,,,,Shell road map metropolitan Ottawa and Quebec,,,H.M. Gousha Company,,,,,,eng,,,,,,,,,,,,,,,,,
2,,,3913436,"Metropolitan Ottawa and vicinity ; Carte métropolitain ville de Québec, 1946",Metropolitan Ottawa and vicinity ; Carte métropolitain ville de Québec,eng fre,,1946,,,,,,,,,,,,,,,,165,,#1,,,,,,Shell map of metropolitan Ottawa and Quebec,,,H.M. Gousha Company,,,,,,eng,,,,,,,,,,,,,,,,,
2,,,3923756,"Mexico City & vicinity, 1993",Mexico City & vicinity,eng fre ger spa,,1993,,,,,,,,,,,,,,,,169,,#1,,,,,,Cityflash visitors map Mexico City,,,Rand McNally and Company,,,,,,eng,,,,,,,,,,,,,,,,,
2,,,3923714,"Mexico mapa touristico de carreteras, 1966",Mexico mapa touristico de carreteras,eng spa,,1966,,,,,,,,,,,,,,,,168,,#1,,,,,,Mexico mapa touristico de carreteras,,,Mexico Secretaría de Obras Públicas,,,,,,spa,,,,,,,,,,,,,,,,,
2,,,3923735,"Mexico mapa touristico de carreteras, 1966",Mexico mapa touristico de carreteras,eng spa,,1966,,,,,,,,,,,,,,,,169,,#1,,,,,,Mexico mapa touristico de carreteras,,,Mexico. Secretaría de Obras Públicas,,,,,,spa,,,,,,,,,,,,,,,,,
2,,,3923741,"Mexico mapa touristico de carreteras, 1966",Mexico mapa touristico de carreteras,eng spa,,1966,,,,,,,,,,,,,,,,169,,#1,,,,,,Mexico mapa touristico de carreteras,,,Mexico. Secretaría de Obras Públicas,,,,,,spa,,,,,,,,,,,,,,,,,
2,,,3923739,"Mexico mapa turistico de carreteras = Mexico tourist road map, 1936",Mexico mapa turistico de carreteras = Mexico tourist road map,eng spa,,1936,,,,,,,,,,,,,,,,229,,#1,,,,,,Mexico mapa turistico de carreteras = Mexico tourist road map,,,Guia Roji S.A.,,,,,,spa,,,,,,,,,,,,,,,,,
2,,,3923743,"Mexiko = México = Mexico = Mexique, [between 1980 and 1989]",Mexiko = México = Mexico = Mexique,eng fre ger spa,[between 1980 and 1989],,,,,,,,,,,,,,,,,229,,#1,,,,,,Mexico = Mexique = Mexiko = México,,,Hallwag AG,,,,,,eng,,,,,,,,,,,,,,,,,
2,,,3912764,"Milano : pianta = Milano : plan = Milano : town map = Milano : Stadtplan, 1968",Milano : pianta = Milano : plan = Milano : town map = Milano : Stadtplan,Ita fre eng ger,,1968,,,,,,,,,,,,,,,,236,,#1,,,,,,Milano : pianta = Milano : plan = Milano : map,,,Hallwag,,,,,,ita,,,,,,,,,,,,,,,,,
2,,,3913228,"Montréal, 1970",Montréal,eng fre,,1970,,,,,,,,,,,,,,,,164,,#1,,,,,,Montréal,,,Montréal City Planning Department,,,,,,fre,,,,,,,,,,,,,,,,,
2,,,3913211,"Montreal and vicinity, 1961",Montréal,eng fre,[between 1980 and 1989?],,,,,,,,,,,,,,,,,164,,#1,,,,,,Montréal access to the city,,,Quebec (Province). Tourist Bureau,,,,,,eng,,,,,,,,,,,,,,,,,
2,,,3913205,"Montreal métropole de Canada, 1959",Montreal and vicinity,eng fre,,1961,,,,,,,,,,,,,,,,163,,#1,,,,,,Street guide and map of Montreal and vicinity,,,Rolph-Clark-Stone Limited.,,,,,,eng,,,,,,,,,,,,,,,,,
2,,,3913215,"Montréal and vicinity, 1961",Montréal and vicinity,eng fre,,1961,,,,,,,,,,,,,,,,163,,#1,,,,,,Montréal,,,Rolph-Clark-Stone Limited.,,,,,,eng,,,,,,,,,,,,,,,,,
2,,,3913217,"Montréal et environs = Montréal and vicinity, 1963",Montréal et environs = Montréal and vicinity,eng fre,,1963,,,,,,,,,,,,,,,,163,,#1,,,,,,Guide des rues et carte de Montréal et des environs = Street guide and metropolitan map of Montreal,,,Rolph-Clark-Stone Limited.,,,,,,fre,,,,,,,,,,,,,,,,,
2,,,3913221,"Montréal et environs = Montréal and vicinity, 1968",Montréal et environs = Montréal and vicinity,eng fre,,1968,,,,,,,,,,,,,,,,163,,#1,,,,,,Montreal,,,Rolph-Clark-Stone Limited.,,,,,,fre,,,,,,,,,,,,,,,,,
2,,,3913224,"Montréal et environs = Montréal and vicinity, 1965",Montréal et environs = Montréal and vicinity,eng fre,,1965,,,,,,,,,,,,,,,,164,,#1,,,,,,Montreal,,,Rolph-Clark-Stone Limited,,,,,,fre,,,,,,,,,,,,,,,,,
2,,,3913227,"Montréal et environs = Montréal and vicinity, [1967?]",Montréal et environs = Montréal and vicinity,eng fre,[1967?],,,,,,,,,,,,,,,,,226,,#1,,,,,,Map of Montreal = Carte de Montréal,,,"John Lovell & Son, Limited",,,,,,fre,,,,,,,,,,,,,,,,,
2,,,3913230,"Montréal et environs = Montréal and vicinity, 1971",Montréal et environs = Montréal and vicinity,eng fre,,1971,,,,,,,,,,,,,,,,164,,#1,,,,,,Montréal,,,Rolph-Clark-Stone Limited,,,,,,fre,,,,,,,,,,,,,,,,,
2,,,3913228,"Montréal, 1970",Montreal métropole de Canada,eng fre,,1959,,,,,,,,,,,,,,,,226,,#1,,,,,,Montréal paradis du tourisme = Montréal tourist guide,,,Société Nouvelle de Publicité Incorporée,,,,,,fre,,,,,,,,,,,,,,,,,
2,,,3913234,"Montréal mid-town, [1979?]",Montréal mid-town,eng fre,[1979?],,,,,,,,,,,,,,,,,164,,#1,,,,,,Montréal access to the city,,,Quebec (Province). Tourist Bureau,,,,,,fre,,,,,,,,,,,,,,,,,
2,,,3912382,"Motoring map = Karte für Kraftfahrer = Carte routiére (Danmark, Finland, Norge, Sverige), 1937","Motoring map = Karte für Kraftfahrer = Carte routiére (Danmark, Finland, Norge, Sverige)",Eng fre ger,,1937,,,,,,,,,,,,,,,,233,,#1,,,,,,Motoring map = Carte routiére = Karte für Kraftfahrer,,,Nordisk Turisttrafikkomite ; Scott-R.,,,,,,eng,,,,,,,,,,,,,,,,,
2,,,3913424,"National Capital Ottawa & environs = Ottawa & environs la capitale nationale, 1959",National Capital Ottawa & environs = Ottawa & environs la capitale nationale,eng fre,,1959,,,,,,,,,,,,,,,,227,,#1,,,,,,Map of Ottawa and the National Capital Region = Plan d'Ottawa et la reégion de la capitale nationale,,,National Capital Commission,,,,,,eng,,,,,,,,,,,,,,,,,
2,,,3913425,"National Capital Ottawa & environs = Ottawa & environs la capitale nationale, 1957",National Capital Ottawa & environs = Ottawa & environs la capitale nationale,eng fre,,1957,,,,,,,,,,,,,,,,227,,#1,,,,,,Map of Ottawa and Environs and Gatineau Park = Plan d'Ottawa et des environs et du parc de la Gatineau,,,Federal District  Commission,,,,,,eng,,,,,,,,,,,,,,,,,
2,,,3913090,"New Brunswick = Nouveau-Brunswick, 1982",New Brunswick = Nouveau-Brunswick,eng fre,,1982,,,,,,,,,,,,,,,,225,,#1,,,,,,New Brunswick Canada ,,,New Brunswick. Department of Tourism,,,,,,eng,,,,,,,,,,,,,,,,,
2,,,3912403,"Norge, 1969",Norge,Nob ger eng fre,,1969,,,,,,,,,,,,,,,,158,,#1,,,,,,,,,[publisher not identified],,,,,,nob,,,,,,,,,,,,,,,,,
2,,,3913332,"Northern Ontario ; Southern Ontario, 1967",Northern Ontario ; Southern Ontario,eng fre,,1967,,,,,,,,,,,,,,,,164,,#1,,,,,,Ontario,,,"Rolph-Clark-Stone, Limited",,,,,,eng,,,,,,,,,,,,,,,,,
2,,,3913266,"Nouveau plan de la cité de Québec région metropolitaine et les environs avec lévis et lauzon, [between 1950 and 1959?]",Nouveau plan de la cité de Québec région metropolitaine et les environs avec lévis et lauzon,eng fre,[between 1950 and 1959?],,,,,,,,,,,,,,,,,226,,#1,,,,,,New map of Quebec City metropolitan area,,,A.G. Hatelie,,,,,,eng,,,,,,,,,,,,,,,,,
2,,,3912720,"Nuevo plano y callejero de cobranzas Madrid, 1929",Nuevo plano y callejero de cobranzas Madrid,Spa fre eng ger,,1929,,,,,,,,,,,,,,,,236,,#1,,,,,,Madrid,,,Rivadeneyra S.A.,,,,,,spa,,,,,,,,,,,,,,,,,
2,,,3912805,"Nuovissima pianta di Roma = Nouveau plan de Rome = New plan of Rome, [between 1970 and 1979?]",Nuovissima pianta di Roma = Nouveau plan de Rome = New plan of Rome,ita eng fre ger spa,[between 1970 and 1979?],,,,,,,,,,,,,,,,,237,,#1,,,,,,Nuova pianta di Roma = Nouveau plan de Rome = New plan of Rome = Neuer Stadtplan von Rom = Neuva mapa de Roma,,,Enrico Verdesi,,,,,,ita,,,,,,,,,,,,,,,,,
2,,,3912795,"Nuovissima pianta Roma = Nouveau plan de Rome = New plan of Rome = Neuer Stadtplan von Rom = Mapa de Roma, [between 1950 and 1959?]",Nuovissima pianta Roma = Nouveau plan de Rome = New plan of Rome = Neuer Stadtplan von Rom = Mapa de Roma,ita eng fre ger spa,[between 1950 and 1959?],,,,,,,,,,,,,,,,,236,,#1,,,,,,Nuovissima pianta = Nouveau plan = new plan = Neuer Stadtplan von = Mapa de Roma ,,,Enrico Verdesi,,,,,,ita,,,,,,,,,,,,,,,,,
2,,,3912804,"Nuovissima pianta Roma = Nouveau plan de Rome = New plan of Rome = Neuer Stadtplan von Rom = Mapa de Roma, 1955",Nuovissima pianta Roma = Nouveau plan de Rome = New plan of Rome = Neuer Stadtplan von Rom = Mapa de Roma,ita eng fre ger spa,,1955,,,,,,,,,,,,,,,,237,,#1,,,,,,Nuovissima pianta = Nouveau plan = New plan = Neuer Stadtplan = Mapa de Roma,,,Enrico Verdesi,,,,,,ita,,,,,,,,,,,,,,,,,
2,,,3913280,"Official Arrow city map cité de Québec et ses environs Québec, [between 1960 and 1969?]",Official Arrow city map cité de Québec et ses environs Québec,eng fre,[between 1960 and 1969?],,,,,,,,,,,,,,,,,226,,#1,,,,,,Québec et banlieue official Arrow city map = Quebec and vicinity official Arrow city map,,,R.L. Polk & Co.,,,,,,fre,,,,,,,,,,,,,,,,,
2,,,3913281,"Official Arrow city map cité de Québec et ses environs Québec, [between 1960 and 1969?]",Official Arrow city map cité de Québec et ses environs Québec,eng fre,[between 1960 and 1969?],,,,,,,,,,,,,,,,,226,,#1,,,,,,Québec et banlieue = Quebec and vincinity,,,R.L. Polk & Co.,,,,,,fre,,,,,,,,,,,,,,,,,
2,,,3923717,"Official road map Mexico = Carta general de carreteras República Mexicana, 1935",Official road map Mexico = Carta general de carreteras República Mexicana,eng spa,,1935,,,,,,,,,,,,,,,,168,,#1,,,,,,Travel Republic of Mexico with Conoco,,,H.M. Gousha Co.,,,,,,eng,,,,,,,,,,,,,,,,,
2,,,3923721,"Official road map Mexico = Carta general de carreteras República Mexicana, 1933",Official road map Mexico = Carta general de carreteras República Mexicana,eng spa,,1933,,,,,,,,,,,,,,,,168,,#1,,,,,,Travel Republic of Mexico with Conoco,,,H.M. Gousha Co.,,,,,,eng,,,,,,,,,,,,,,,,,
2,,,3913127,"Official road map of Quebec = Carte routière officielle de Quebec, 1942",Official road map of Quebec = Carte routière officielle de Quebec,eng fre,,1942,,,,,,,,,,,,,,,,163,,#1,,,,,,Shell map of Quebec,,,H.M. Gousha Co.,,,,,,eng,,,,,,,,,,,,,,,,,
2,,,3913124,"Official road map province of Quebec = Carte routière officielle province de Quebec, [1935?]",Official road map province of Quebec = Carte routière officielle province de Quebec,eng fre,[1935?],,,,,,,,,,,,,,,,,163,,#1,,,,,,Shell road map Quebec,,,H.M. Gousha Co.,,,,,,eng,,,,,,,,,,,,,,,,,
2,,,3913362,"Ontario, 1963",Ontario,eng fre,,1963,,,,,,,,,,,,,,,,164,,#1,,,,,,Ontario,,,"Gousha Maps of Canada, Ltd.",,,,,,eng,,,,,,,,,,,,,,,,,
2,,,3913363,"Ontario, 1963",Ontario,eng fre,,1963,,,,,,,,,,,,,,,,164,,#1,,,,,,Ontario,,,H.M. Gousha Company,,,,,,eng,,,,,,,,,,,,,,,,,
2,,,3913370,"Ontario, 1971",Ontario,eng fre,,1971,,,,,,,,,,,,,,,,164,,#1,,,,,,"Ontario featuring city area maps of Hamilton, Ottawa and metropolitan Toronto",,,Grant-Mann Lithographers Ltd.,,,,,,fre,,,,,,,,,,,,,,,,,
2,,,3913371,"Ontario, 1971",Ontario,eng fre,,1971,,,,,,,,,,,,,,,,164,,#1,,,,,,Ontario,,,H.M. Gousha Company,,,,,,eng,,,,,,,,,,,,,,,,,
2,,,3913375,"Ontario, 1985",Ontario,eng fre,,1985,,,,,,,,,,,,,,,,164,,#1,,,,,,Ontario,,,Allmaps Canada Ltd.,,,,,,fre,,,,,,,,,,,,,,,,,
2,,,3913361,"Ontario ; Northern Ontario = Nord de l'Ontario, 1963",Ontario ; Northern Ontario = Nord de l'Ontario,eng fre,,1963,,,,,,,,,,,,,,,,164,,#1,,,,,,Ontario,,,H.M. Gousha Company,,,,,,eng,,,,,,,,,,,,,,,,,
2,,,3913368,"Ontario ; Northern Ontario = Nord de l'Ontario, 1969",Ontario ; Northern Ontario = Nord de l'Ontario,eng fre,,1969,,,,,,,,,,,,,,,,164,,#1,,,,,,Ontario,,,H.M. Gousha Company,,,,,,fre,,,,,,,,,,,,,,,,,
2,,,3913308,"Ontario, Canada 1982/83 Official road map, 1982","Ontario, Canada 1982/83 Official road map",eng fre,,1982,,,,,,,,,,,,,,,,227,,#1,,,,,,"Ontario, Canada 1982/83 official road map",,,Ministry of Transportation and Communications,,,,,,fre,,,,,,,,,,,,,,,,,
2,,,3913420,"Ottawa & environs, 1963",Ottawa & environs ,eng fre,,1963,,,,,,,,,,,,,,,,227,,#1,,,,,,NCC map of Ottawa = Carte d'Ottawa CCN,,,National Capital Commission,,,,,,eng,,,,,,,,,,,,,,,,,
2,,,3913421,"Ottawa & environs, 1961",Ottawa & environs ,eng fre,,1961,,,,,,,,,,,,,,,,227,,#1,,,,,,NCC map of Ottawa = Carte d'Ottawa CCN,,,National Capital Commission,,,,,,eng,,,,,,,,,,,,,,,,,
2,,,3913447,"Ottawa and vicinity = Ottawa et environs, 1963",Ottawa and vicinity = Ottawa et environs,eng fre,,1963,,,,,,,,,,,,,,,,165,,#1,,,,,,Ottawa,,,Rolph Clark Stone Ltd.,,,,,,eng,,,,,,,,,,,,,,,,,
2,,,3913449,"Ottawa and vicinity = Ottawa et environs, 1968",Ottawa and vicinity = Ottawa et environs,eng fre,,1968,,,,,,,,,,,,,,,,165,,#1,,,,,,Ottawa,,,Rolph Clark Stone Ltd.,,,,,,eng,,,,,,,,,,,,,,,,,
2,,,3913438,"Ottawa bus routes = Lignes d'autobus, [between 1950 and 1959?]",Ottawa bus routes = Lignes d'autobus,eng,[between 1950 and 1959?],,,,,,,,,,,,,,,,,165,,#1,,,,,,,,,Rapid Grip and Batten Limited,,,,,,eng,,,,,,,,,,,,,,,,,
2,,,3912423,"Panorama over Bergen fra Fløien ; Kart over Bergen og Fløifjellet, 1933",Panorama over Bergen fra  Fløien ; Kart over Bergen og Fløifjellet,Nor eng ger,,1933,,,,,,,,,,,,,,,,233,,#1,,,,,,Utsikt over Bergen fra Fløibanen = View of Bergen from Fløibanen = Aussicht über Bergen von Fløibanen,,,Leif Riim,,,,,,nor,,,,,,,,,,,,,,,,,
2,,,3912672,"Paris plan de ville = Paris town map = Paris Stadtplan, [1961?]",Paris plan de ville = Paris town map = Paris Stadtplan,Fre eng ger,[1961?],,,,,,,,,,,,,,,,,235,,#1,,,,,,Paris map = Paris plan,,,Hallwag,,,,,,fre,,,,,,,,,,,,,,,,,
2,,,3923783,"Parques nacionales y otras areas proteguidas de Costa Rica, 1999",Parques nacionales y otras areas proteguidas de Costa Rica,eng spa,,1999,,,,,,,,,,,,,,,,169,,#1,,,,,,National parks and other protected areas of Costa Rica,,,Costa Rica. Instituto Geografico Nacional,,,,,,spa,,,,,,,,,,,,,,,,,
2,,,3913120,"Partie occidentale Québec western part 1964/ Partie orientale Québec eastern part 1964, 1964",Partie occidentale Québec western part 1964/ Partie orientale Québec eastern part 1964,eng fre,,1964,,,,,,,,,,,,,,,,163,,#1,,,,,,Québec,,,General Drafting Company,,,,,,fre,,,,,,,,,,,,,,,,,
2,,,3913273,"Partie oriental Quebec eastern part 1955 ; Partie occidental Quebec western part 1955, 1955",Partie oriental Quebec eastern part 1955 ; Partie occidental Quebec western part 1955,eng fre,,1955,,,,,,,,,,,,,,,,226,,#1,,,,,,Quebec,,,General Drafting Company,,,,,,fre,,,,,,,,,,,,,,,,,
2,,,3913110,"Partie orientale Quebec eastern part ; Partie occidental Quebec western part 1950, 1950",Partie orientale Quebec eastern part ; Partie occidental Quebec western part 1950,eng fre,,1950,,,,,,,,,,,,,,,,225,,#1,,,,,,Quebec,,,General Drafting Company,,,,,,eng,,,,,,,,,,,,,,,,,
2,,,3913115,"Partie orientale Quebec eastern part ; Partie occidental Quebec western part 1951, 1951",Partie orientale Quebec eastern part ; Partie occidental Quebec western part 1951,eng fre,,1951,,,,,,,,,,,,,,,,225,,#1,,,,,,Quebec road map,,,General Drafting Company,,,,,,eng,,,,,,,,,,,,,,,,,
2,,,3913133,"Partie orientale Quebec eastern part ; Partie occidental Quebec western part 1951, 1951",Partie orientale Quebec eastern part ; Partie occidental Quebec western part 1951,eng fre,,1951,,,,,,,,,,,,,,,,225,,#1,,,,,,Quebec road map,,,General Drafting Company,,,,,,eng,,,,,,,,,,,,,,,,,
2,,,3913114,"Partie orientale Quebec eastern part ; Partie occidental Quebec western part 1952, 1952",Partie orientale Quebec eastern part ; Partie occidental Quebec western part 1952,eng fre,,1952,,,,,,,,,,,,,,,,225,,#1,,,,,,Quebec road map,,,General Drafting Company,,,,,,eng,,,,,,,,,,,,,,,,,
2,,,3913113,"Partie orientale Quebec eastern part ; Partie occidental Quebec western part 1953, 1948",Partie orientale Quebec eastern part ; Partie occidental Quebec western part 1953,eng fre,,1948,,,,,,,,,,,,,,,,225,,#1,,,,,,Quebec,,,General Drafting Company,,,,,,eng,,,,,,,,,,,,,,,,,
2,,,3913109,"Partie orientale Quebec eastern part ; Partie occidental Quebec western part 1954, 1954",Partie orientale Quebec eastern part ; Partie occidental Quebec western part 1954,eng fre,,1954,,,,,,,,,,,,,,,,225,,#1,,,,,,Quebec,,,General Drafting Company,,,,,,eng,,,,,,,,,,,,,,,,,
2,,,3913107,"Partie orientale Quebec eastern part ; Partie occidental Quebec western part 1955, 1955",Partie orientale Quebec eastern part ; Partie occidental Quebec western part 1955,eng fre,,1955,,,,,,,,,,,,,,,,225,,#1,,,,,,Quebec,,,General Drafting Company,,,,,,fre,,,,,,,,,,,,,,,,,
2,,,3913135,"Partie orientale Quebec eastern part ; Partie occidental Quebec western part 1955, 1955",Partie orientale Quebec eastern part ; Partie occidental Quebec western part 1955,eng fre,,1955,,,,,,,,,,,,,,,,225,,#1,,,,,,Quebec,,,General Drafting Company,,,,,,eng,,,,,,,,,,,,,,,,,
2,,,3913158,"Partie orientale Quebec eastern part 1957 ; Partie occidental Quebec western part 1957, 1957",Partie orientale Quebec eastern part ; Partie occidental Quebec western part 1957,eng fre,,1957,,,,,,,,,,,,,,,,163,,#1,,,,,,Quebec,,,General Drafting Company,,,,,,fre,,,,,,,,,,,,,,,,,
2,,,3913117,"Partie orientale Quebec eastern part 1956 ; Partie occidental Quebec western part 1956, 1956",Partie orientale Quebec eastern part 1956 ; Partie occidental Quebec western part 1956,eng fre,,1956,,,,,,,,,,,,,,,,163,,#1,,,,,,Quebec,,,General Drafting Company,,,,,,eng,,,,,,,,,,,,,,,,,
2,,,3913122,"Partie orientale Quebec eastern part ; Partie occidental Quebec western part 1957, 1957",Partie orientale Quebec eastern part 1957 ; Partie occidental Quebec western part 1957,eng fre,,1957,,,,,,,,,,,,,,,,163,,#1,,,,,,Quebec,,,General Drafting Company,,,,,,eng,,,,,,,,,,,,,,,,,
2,,,3913118,"Partie orientale Quebec eastern part 1958 ; Partie occidental Quebec western part 1958, 1958",Partie orientale Quebec eastern part 1958 ; Partie occidental Quebec western part 1958,eng fre,,1958,,,,,,,,,,,,,,,,163,,#1,,,,,,Quebec,,,General Drafting Company,,,,,,eng,,,,,,,,,,,,,,,,,
2,,,3913121,"Partie orientale Quebec eastern part 1958 ; Partie occidental Quebec western part 1958, 1958",Partie orientale Quebec eastern part 1958 ; Partie occidental Quebec western part 1958,eng fre,,1958,,,,,,,,,,,,,,,,163,,#1,,,,,,Quebec,,,General Drafting Company,,,,,,eng,,,,,,,,,,,,,,,,,
2,,,3913144,"Partie orientale Québec eastern part 1964 ; Partie occidental Québec western part 1964, 1964",Partie orientale Québec eastern part 1964 ; Partie occidental Québec western part 1964,eng fre,,1964,,,,,,,,,,,,,,,,163,,#1,,,,,,Québec,,,General Drafting Company,,,,,,fre,,,,,,,,,,,,,,,,,
2,,,3913145,"Partie orientale Québec eastern part 1965 ; Partie occidental Qubec western part 1965, 1965",Partie orientale Québec eastern part 1965 ; Partie occidental Qubec western part 1965,eng fre,,1965,,,,,,,,,,,,,,,,163,,#1,,,,,,Québec,,,General Drafting Company,,,,,,fre,,,,,,,,,,,,,,,,,
2,,,3912807,"Pianta della città di Roma e dintorni, [between 1910 and 1919?]",Pianta della città di Roma e dintorni,ita fre,[between 1910 and 1919?],,,,,,,,,,,,,,,,,237,,#1,,,,,,Città di Roma e dintorni = Plan der Stadt Rom und Umgebung = Rome et ses environs = Rome and its environs,,,Carlo Marrè Antonelli,,,,,,ita,,,,,,,,,,,,,,,,,
2,,,3913177,"Plan [Montréal], 1949",Plan [Montréal],eng fre,,1949,,,,,,,,,,,,,,,,226,,#1,,,,,,,,,Paul Gauthier,,,,,,eng,,,,,,,,,,,,,,,,,
2,,,3913178,"Plan [Montréal], 1949",Plan [Montréal],eng fre,,1949,,,,,,,,,,,,,,,,226,,#1,,,,,,,,,Paul Gauthier,,,,,,eng,,,,,,,,,,,,,,,,,
2,,,3912376,"Plan de Bruxelles = Map of Brussels = Plan van Brussel = Plan von Brüssels, [between 1946-1954?]",Plan de Bruxelles = Map of Brussels = Plan van Brussel = Plan von Brüssels,Fre eng dut ger,[between 1946-1954?],,,,,,,,,,,,,,,,,158,,#1,,,,,,,,,A. de Boeck,,,,,,fre,,,,,,,,,,,,,,,,,
2,,,3913256,"Plan de la cité de Québec, [between 1950 and 1959?]",Plan de la cité de Québec,eng fre,[between 1950 and 1959?],,,,,,,,,,,,,,,,,226,,#1,,,,,,Tourist map of Québec = plan touristique de Québec,,,Quebec Municipal Tourist Bureau,,,,,,fre,,,,,,,,,,,,,,,,,
2,,,3913257,"Plan de la cité de Québec, [between 1960 and 1969?]",Plan de la cité de Québec,eng fre,[between 1960 and 1969?],,,,,,,,,,,,,,,,,226,,#1,,,,,,Tourist map of Québec = plan touristique de Québec,,,Quebec Municipal Tourist Bureau,,,,,,fre,,,,,,,,,,,,,,,,,
2,,,3913259,"Plan de la cité de Québec, [between 1940 and 1949?]",Plan de la cité de Québec,eng fre,[between 1940 and 1949?],,,,,,,,,,,,,,,,,226,,#1,,,,,,Tourist map and street guide of Quebec City Quebec ,,,Croydon Publishing Co.,,,,,,eng,,,,,,,,,,,,,,,,,
2,,,3913263,"Plan de la cité de Québec, [between 1950 and 1959?]",Plan de la cité de Québec,eng fre,[between 1950 and 1959?],,,,,,,,,,,,,,,,,226,,#1,,,,,,Tourist map of Québec = Plan touristique de Québec,,,Quebec Municipal Tourist Bureau,,,,,,fre,,,,,,,,,,,,,,,,,
2,,,3913264,"Plan de la cité de Québec, [between 1950 and 1959?]",Plan de la cité de Québec,eng fre,[between 1950 and 1959?],,,,,,,,,,,,,,,,,226,,#1,,,,,,Tourist map of Québec = Plan touristique de Québec,,,Quebec Municipal Tourist Bureau,,,,,,fre,,,,,,,,,,,,,,,,,
2,,,3913270,"Plan de la cité de Québec, [between 1950 and 1959?]",Plan de la cité de Québec,eng fre,[between 1950 and 1959?],,,,,,,,,,,,,,,,,226,,#1,,,,,,Tourist map of Québec = plan touristique de Québec,,,Quebec Municipal Tourist Bureau,,,,,,fre,,,,,,,,,,,,,,,,,
2,,,3913271,"Plan de la cité de Québec, [between 1950 and 1959?]",Plan de la cité de Québec,eng fre,[between 1950 and 1959?],,,,,,,,,,,,,,,,,226,,#1,,,,,,Tourist map of Québec = plan touristique de Québec,,,Quebec Municipal Tourist Bureau,,,,,,fre,,,,,,,,,,,,,,,,,
2,,,3913272,"Plan de la cité de Québec, [between 1950 and 1959?]",Plan de la cité de Québec,eng fre,[between 1950 and 1959?],,,,,,,,,,,,,,,,,226,,#1,,,,,,Tourist map of Québec = plan touristique de Québec,,,Quebec Municipal Tourist and Industry Bureau,,,,,,fre,,,,,,,,,,,,,,,,,
2,,,3913275,"Plan de la cité de Québec, [between 1960 and 1969?]",Plan de la cité de Québec,eng fre,[between 1960 and 1969?],,,,,,,,,,,,,,,,,226,,#1,,,,,,Plan touristique Québec = Québec tourist map,,,Quebec Municpal Tourist Bureau,,,,,,fre,,,,,,,,,,,,,,,,,
2,,,3913276,"Plan de la cité de Québec, [between 1960 and 1969?]",Plan de la cité de Québec,eng fre,[between 1960 and 1969?],,,,,,,,,,,,,,,,,226,,#1,,,,,,Plan touristique Québec = Québec tourist map,,,Quebec Municipal Tourist Bureau,,,,,,fre,,,,,,,,,,,,,,,,,
2,,,3913277,"Plan de la cité de Québec, [between 1960 and 1969?]",Plan de la cité de Québec,eng fre,[between 1960 and 1969?],,,,,,,,,,,,,,,,,226,,#1,,,,,,Plan touristique Québec = Québec tourist map,,,Quebec Municipal Tourist Bureau,,,,,,fre,,,,,,,,,,,,,,,,,
2,,,3913287,"Plan de la cité de Québec, 1968",Plan de la cité de Québec,eng fre,[1963?],,,,,,,,,,,,,,,,,164,,#1,,,,,,Plan touristique Québec = Québec tourist map,,,Quebec Municipal Tourist Bureau,,,,,,fre,,,,,,,,,,,,,,,,,
2,,,3913289,"Plan de la cité de Québec, 1969",Plan de la cité de Québec,eng fre,,1968,,,,,,,,,,,,,,,,164,,#1,,,,,,Plan touristique Québec tourist map,,,Quebec Municipal Tourist Bureau,,,,,,fre,,,,,,,,,,,,,,,,,
2,,,3913283,"Plan de la cité de Québec, [1963?]",Plan de la cité de Québec,eng fre,,1969,,,,,,,,,,,,,,,,164,,#1,,,,,,Plan touristique Québec = Québec tourist map,,,Office Municipal du Tourisme,,,,,,fre,,,,,,,,,,,,,,,,,
2,,,3913303,"Plan de la cité de Trois-Rivières, 1950",Plan de la cité de Trois-Rivières ,eng fre,,1950,,,,,,,,,,,,,,,,164,,#1,,,,,,"Visitez Trois-Rivières province de Québec = Visit Trois-Rivières province de Québec, Canada",,,Georges Heroux,,,,,,fre,,,,,,,,,,,,,,,,,
2,,,3913305,"Carte des cités des Trois-Rivières et du Cap-de-la-Madeleine Québec, [between 1950 and 1959?]",Plan de la ville de Trois-Rivières ,eng fre,[between 1950 and 1959?],,,,,,,,,,,,,,,,,164,,#1,,,,,,"Visit historic Trois-Rivières province of Quebec, Canada",,,Georges Heroux,,,,,,fre,,,,,,,,,,,,,,,,,
2,,,3912793,"Plan de Rome = Map of Rome, [approximately 1960?]",Plan de Rome = Map of Rome,Fre eng,[approximately 1960?],,,,,,,,,,,,,,,,,161,,#1,,,,,,,,,G.Paglia,,,,,,fre,,,,,,,,,,,,,,,,,
2,,,3913292,"Plan general de la cité de St-Hyacinthe et du grand St-Hyacinthe = General plan of the city of St-Hyacinthe and of the greater St-Hyacinthe, 1958",Plan general de la cite de St-Hyacinthe et du grand St-Hyacinthe = General plan of the city of St-Hyacinthe and of the greater St-Hyacinthe ,eng fre,,1958,,,,,,,,,,,,,,,,164,,#1,,,,,,,,,B. Desnoyers,,,,,,fre,,,,,,,,,,,,,,,,,
2,,,3913297,"Plan general de la cite de St-Hyacinthe et du grand St-Hyacinthe = General plan of the city of St-Hyacinthe and of the greater St-Hyacinthe, 1958",Plan general de la cité de St-Hyacinthe et du grand St-Hyacinthe = General plan of the city of St-Hyacinthe and of the greater St-Hyacinthe ,eng fre,,1958,,,,,,,,,,,,,,,,226,,#1,,,,,,,,,B. Desnoyers,,,,,,fre,,,,,,,,,,,,,,,,,
2,,,3913197,"Plan touristic Montreal = Plan Montreal touristique, [between 1950 and 1959?]",Plan touristic Montreal = Plan Montreal touristique,eng fre,[between 1950 and 1959?],,,,,,,,,,,,,,,,,163,,#1,,,,,,Montreal,,,Montreal Tourist & Convention Bureau Inc.,,,,,,eng,,,,,,,,,,,,,,,,,
2,,,3912368,"Plan van Antwerpen en grote omgeving, [approximately 1962?]",Plan van Antwerpen en grote omgeving,Dut fre,[approximately 1962?],,,,,,,,,,,,,,,,,233,,#1,,,,,,Plan van Antwerpen en grote omgeving  = Plan d'Anvers et de la grande banlieue,,,R. de Rouck,,,,,,dut,,,,,,,,,,,,,,,,,
2,,,3923795,"Plano de Barranquilla, 1933",Plano de Barranquilla,eng spa,,1933,,,,,,,,,,,,,,,,169,,#1,,,,,,Guia de turismo de Barranquilla = Tourist guide of Barranquilla,,,Colombia Ministerios de Industrias,,,,,,spa,,,,,,,,,,,,,,,,,
