2,,,3913167,"Carte routiére et touristique de la province de Quèbec 1930 = Tourist and highway map of the province de Québec 1930, 1930",Carte routiére et touristique de la province de Quèbec 1930 = Tourist and highway map of the province de Québec 1930,eng fre,,1930,,,,,,,,,,,,,,,,225,,#1,,,,,,Province de Québec Canada carte routière et touristique 1930 = Province of Québec Canada highway and tourist map 1930,,,Québec (Province). Provincial Publicity Bureau. Tourist Branch,,,,,,fre,,,,,,,,,,,,,,,,,
2,,,3913104,"Carte routière Quebec = Road map of Quebec ; Road map of Maritime Provinces, 1962",Carte routière Quebec = Road map of Quebec ; Road map of Maritime Provinces,eng fre,,1962,,,,,,,,,,,,,,,,225,,#1,,,,,,Quebec et les Provinces Maritimes = Maritime Provinces and Quebec,,,Rolph-Clark-Stone Limited,,,,,,fre,,,,,,,,,,,,,,,,,
2,,,3913218,"Cartes des lignes = Route map, 1963",Cartes des lignes = Route map,eng fre,,1963,,,,,,,,,,,,,,,,163,,#1,,,,,,Cartes des lignes = Route map,,,Montreal Transportation Commission,,,,,,fre,,,,,,,,,,,,,,,,,
2,,,3913231,"Cartes des rue de Montréal et environs = Street map of Montréal and vincinity, 1971",Cartes des rue de Montréal et environs = Street map of Montréal and vincinity ,eng fre,,1971,,,,,,,,,,,,,,,,164,,#1,,,,,,Montréal,,,Grant-Mann Lithographers Limited.,,,,,,fre,,,,,,,,,,,,,,,,,
2,,,3913236,"Cartes des rue de Montréal et environs = Street map of Montréal and vincinity, 1985",Cartes des rue de Montréal et environs = Street map of Montréal and vincinity ,eng fre,,1985,,,,,,,,,,,,,,,,164,,#1,,,,,,Montreal,,,H.M. Gousha Co.,,,,,,fre,,,,,,,,,,,,,,,,,
2,,,3912400,"CentralKøbenhaven = Copenhagen (the central area), 1969",CentralKøbenhaven = Copenhagen (the central area),Dut eng,,1969,,,,,,,,,,,,,,,,233,,#1,,,,,,Central-København turistkort = Copenhagen tourist map : the central area,,,Geodætisk Intitut,,,,,,eng,,,,,,,,,,,,,,,,,
2,,,3913209,"Centre de Montréal = Heart of Montreal, [between 1960 and 1969?]",Centre de Montréal = Heart of Montreal,eng fre,[between 1960 and 1969?],,,,,,,,,,,,,,,,,226,,#1,,,,,,Montréal,,,Economic Developmental Bureau of the City of Montreal,,,,,,fre,,,,,,,,,,,,,,,,,
2,,,3913220,"Centre de Montréal = Heart of Montreal, [1964?]",Centre de Montréal = Heart of Montreal,eng fre,[1964?],,,,,,,,,,,,,,,,,226,,#1,,,,,,Montréal,,,Economic Developmental Bureau of the City of Montreal,,,,,,fre,,,,,,,,,,,,,,,,,
2,,,3913254,"Centre-ville Quèbec = Quèbec mid-town, [1983?]",Centre-ville Quèbec = Quèbec mid-town,eng fre,[1983?],,,,,,,,,,,,,,,,,164,,#1,,,,,,Région de Québec carte touristique = Québec region tourist map,,,Ministère de l'Industrie du Commerce et du Tourisme,,,,,,fre,,,,,,,,,,,,,,,,,
2,,,3913172,"Chicoutimi, [between 1960 and 1969?]",Chicoutimi,eng fre,[between 1960 and 1969?],,,,,,,,,,,,,,,,,226,,#1,,,,,,Plan touristique de Chicoutimi = Chicoutimi Tourist Plan,,,Sagueay and Lake St. John Toursit Association,,,,,,eng,,,,,,,,,,,,,,,,,
2,,,3913265,"Cité de Québec, [between 1950 and 1959?]",Cité de Québec,eng fre,[between 1950 and 1959?],,,,,,,,,,,,,,,,,226,,#1,,,,,,Tourist map of Québec = Plan touristique de Québec,,,Quebec Municipal Tourist Bureau,,,,,,fre,,,,,,,,,,,,,,,,,
2,,,3913267,"Cité de Québec, [between 1950 and 1959?]",Cité de Québec,eng fre,[between 1950 and 1959?],,,,,,,,,,,,,,,,,226,,#1,,,,,,Tourist map of Québec = plan touristique de Québec,,,Quebec Municipal Tourist and Industrial Bureau,,,,,,fre,,,,,,,,,,,,,,,,,
2,,,3913268,"Cité de Québec, [between 1950 and 1959?]",Cité de Québec,eng fre,[between 1950 and 1959?],,,,,,,,,,,,,,,,,226,,#1,,,,,,Tourist map of Québec = plan touristique de Québec,,,Quebec Municipal Tourist and Industrial Bureau,,,,,,fre,,,,,,,,,,,,,,,,,
2,,,3912092,"City of London, 1963",City of London,Eng fre ger,,1963,,,,,,,,,,,,,,,,230,,#1,,,,,,Geographers' map of the city of London,,,Geographers' Map Co. Ltd.,,,,,,eng,,,,,,,,,,,,,,,,,
2,,,3913417,"City of Ottawa, 1967",City of Ottawa,eng fre,,1967,,,,,,,,,,,,,,,,227,,#1,,,,,,Tourist map Ottawa = Carte touristique Ottawa,,,City of Ottowa,,,,,,eng,,,,,,,,,,,,,,,,,
2,,,3913418,"City of Ottawa, 1964",City of Ottawa,eng fre,,1964,,,,,,,,,,,,,,,,227,,#1,,,,,,Tourist map Ottawa = Carte touristique Ottawa,,,City of Ottowa,,,,,,eng,,,,,,,,,,,,,,,,,
2,,,3912383,"Danmark, [between 1961 and 1987?]",Danmark,Dan eng,[between 1961 and 1987?],,,,,,,,,,,,,,,,,158,,#1,,,,,,Danmark,,,"Geodætisk Institut ; [General Drafting Co., Inc.?]",,,,,,dan,,,,,,,,,,,,,,,,,
2,,,3912384,"Danmark = Denmark, 1958",Danmark = Denmark,Dan eng,,1958,,,,,,,,,,,,,,,,158,,#1,,,,,,Danmark,,,"Geodætisk Institut ; General Drafting Co., Inc.",,,,,,dan,,,,,,,,,,,,,,,,,
2,,,3912489,"Deutschland Bundesrepublik und Mitteldeutschland, 1962",Deutschland Bundesrepublik und Mitteldeutschland,Ger fre eng swe,,1962,,,,,,,,,,,,,,,,159,,#1,,,,,,,,,Karl Thiemig KG,,,,,,ger,,,,,,,,,,,,,,,,,
2,,,3923643,"Domincan Republic, 1995",Domincan Republic,eng fre ger ita spa,,1995,,,,,,,,,,,,,,,,229,,#1,,,,,,Dominican Republic road map,,,Berndtson & Berndtson,,,,,,eng,,,,,,,,,,,,,,,,,
2,,,3923644,"Domincan Republic, 1996",Domincan Republic,eng fre ger ita spa,,1996,,,,,,,,,,,,,,,,229,,#1,,,,,,Dominican Republic road map,,,Berndtson & Berndtson,,,,,,eng,,,,,,,,,,,,,,,,,
2,,,3912705,"España - Portugal, 1956",España - Portugal,Eng spa,,1956,,,,,,,,,,,,,,,,160,,#1,,,,,,España Portugal,,,"General Drafting Co., Inc.",,,,,,eng,,,,,,,,,,,,,,,,,
2,,,3912012,"Europe : roads and places of interest = Europe : routes et curiosités = Europa : Strassen und Sehenswürdigkeiten, 1973",Europe : roads and places of interest = Europe : routes et curiosités = Europa : Strassen und Sehenswürdigkeiten,Dut ger eng fre,,1973,,,,,,,,,,,,,,,,230,,#1,,,,,,,,,Mairs Geographischer Verlag,,,,,,dut,,,,,,,,,,,,,,,,,
2,,,3912011,"Europe = Europa, [between 1970 and 1979?]",Europe = Europa,Fre eng ger dut ita spa,[between 1970 and 1979?],,,,,,,,,,,,,,,,,230,,#1,,,,,,,,,Fina ; R. de Rouck,,,,,,fre,,,,,,,,,,,,,,,,,
2,,,3912824,"Europe: road map = Europa : carte routiere 28 = Europa : Strassenkarte, 1954",Europe: road map = Europa : carte routiere 28 = Europa : Strassenkarte,Fre eng ita ger dut spa por swe,,1954,,,,,,,,,,,,,,,,237,,#1,,,,,,,,,Alliance Internationale de Tourisme,,,,,,fre,,,,,,,,,,,,,,,,,
2,,,3912723,"Excursiones = sightseeing, 1962",Excursiones = sightseeing,Spa eng fre,,1962,,,,,,,,,,,,,,,,160,,#1,,,,,,,,,"Viajes Viking, S. A.",,,,,,spa,,,,,,,,,,,,,,,,,
2,,,3912712,"Excursiones = Sightseeings = Rundfahrt = Excursions : Madrid, [between 1970 and 1979?]",Excursiones = Sightseeings = Rundfahrt = Excursions : Madrid,Spa eng fre,[between 1970 and 1979?],,,,,,,,,,,,,,,,,160,,#1,,,,,,,,,Meliá,,,,,,spa,,,,,,,,,,,,,,,,,
2,,,3923899,"Expo 67 : Exposition Universelle et Internationale, 1967",Expo 67 : Exposition Universelle et Internationale,Eng fre,,1967,,,,,,,,,,,,,,,,240,,#1,,,,,,,,,Centennial of Canadian Confederation,,,,,,eng,,,,,,,,,,,,,,,,,
2,,,3913226,"Expo67 [Montreal], 1967",Expo67 [Montreal],eng fre,,1967,,,,,,,,,,,,,,,,164,,#1,,,,,,Expo67 [Montreal],,,Rolph-Clark-Stone Limited,,,,,,fre,,,,,,,,,,,,,,,,,
2,,,3913225,"Expo67 Montréal, Canada, 1967","Expo67 Montréal, Canada",eng fre,,1967,,,,,,,,,,,,,,,,164,,#1,,,,,,Expo67 universal and international exhibition Montreal 1967,,,H.M. Gousha Co.,,,,,,fre,,,,,,,,,,,,,,,,,
2,,,3913238,"Expo67 Montréal, Canada, 1967","Expo67 Montréal, Canada",eng fre,,1967,,,,,,,,,,,,,,,,164,,#1,,,,,,,,,General Drafting Company,,,,,,fre,,,,,,,,,,,,,,,,,
2,,,3912820,"Frohe Fahrt durch Österreich = Map of Austria = Carte d'Austriche, 1959",Frohe Fahrt durch Österreich = Map of Austria = Carte d'Austriche,Ger eng fre,,1959,,,,,,,,,,,,,,,,161,,#1,,,,,,,,,G.M. Prutscher,,,,,,ger,,,,,,,,,,,,,,,,,
2,,,3913173,"General plan of the city of Drummondville and of the greater Drummondville = Plan general de la cite de Drummondville et du grand Drummondville, 1966",General plan of the city of Drummondville and of the greater Drummondville = Plan general de la cite de Drummondville et du grand Drummondville,eng fre,,1966,,,,,,,,,,,,,,,,163,,#1,,,,,,Drummond-Ville Québec/Canada,,,Canadian Marconi Company,,,,,,eng,,,,,,,,,,,,,,,,,
2,,,3913174,"General plan of the city of Drummondville and of the greater Drummondville = Plan general de la cite de Drummondville et du grand Drummondville, 1966",General plan of the city of Drummondville and of the greater Drummondville = Plan general de la cite de Drummondville et du grand Drummondville,eng fre,,1966,,,,,,,,,,,,,,,,163,,#1,,,,,,Drummond-Ville Québec/Canada,,,Canadian Marconi Company,,,,,,eng,,,,,,,,,,,,,,,,,
2,,,3912754,"Genova, 1961",Genova,ita eng fre ger spa,,1961,,,,,,,,,,,,,,,,236,,#1,,,,,,Pianta monumentale di Genova = Plan of central Genoa and its monuments = Plan de gênes monumentale = Mapa de Génova monumental = Stadtplan von Genua mit seinen Denkmälern und Bauten,,,Studio Cartografico Ligure,,,,,,ita,,,,,,,,,,,,,,,,,
2,,,3912980,"Gros Morne national park Newfoundland = Parc national du Gros Morne, 1990",Gros Morne national park Newfoundland = Parc national du Gros Morne,eng fre,,1990,,,,,,,,,,,,,,,,162,,#1,,,,,,Gros Morne national park Newfoundland = Parc national due Gros Morne Terre-Neuve,,,Canada. Minister of Supply and Services Canada,,,,,,eng,,,,,,,,,,,,,,,,,
2,,,3923902,"Guia de información y plano de La Habana, 1947",Guia de información y plano de La Habana,Eng spa,,1947,,,,,,,,,,,,,,,,240,,#1,,,,,,,,,[publisher not identified],,,,,,spa,,,,,,,,,,,,,,,,,
2,,,3912879,"Hashemite Kingdom of Jordan tourist map ; Jerusalem (Old City & environs) ; Bethlehem, 1962",Hashemite Kingdom of Jordan tourist map ; Jerusalem (Old City & environs) ; Bethlehem,Eng ara,,1962,,,,,,,,,,,,,,,,237,,#1,,,,,,,,,Department of Lands and Surveys,,,,,,eng,,,,,,,,,,,,,,,,,
2,,,3912515,"Heidelberg, 1964",Heidelberg,Eng ger,,1964,,,,,,,,,,,,,,,,159,,#1,,,,,,,,,Fremdenverkehrsamt Heidelberg ; Magin,,,,,,eng,,,,,,,,,,,,,,,,,
2,,,3912516,"Heidelberg, 1964",Heidelberg,Eng ger,,1964,,,,,,,,,,,,,,,,159,,#1,,,,,,,,,Fremdenverkehrsamt Heidelberg ; Magin,,,,,,eng,,,,,,,,,,,,,,,,,
2,,,3912464,"Helsingin yleiskartta = Helsingfors översiktskarta, 1966",Helsingin yleiskartta = Helsingfors översiktskarta,Fin swe,,1966,,,,,,,,,,,,,,,,159,,#1,,,,,,,,,Hankintatoimisto,,,,,,fin,,,,,,,,,,,,,,,,,
2,,,3912460,"Helsinki = Helsingfors, 1966",Helsinki = Helsingfors,Eng swe ger fre,,1966,,,,,,,,,,,,,,,,159,,#1,,,,,,,,,[publisher not identified],,,,,,eng,,,,,,,,,,,,,,,,,
2,,,3912461,"Helsinki = Helsingfors, 1966",Helsinki = Helsingfors,Eng swe ger fre,,1966,,,,,,,,,,,,,,,,159,,#1,,,,,,,,,[publisher not identified],,,,,,eng,,,,,,,,,,,,,,,,,
2,,,3912458,"Helsinki = Helsingfors : 400 vuotta = 400 år = 400 years, 1950",Helsinki = Helsingfors : 400 vuotta = 400 år = 400 years,Eng swe fin,,1950,,,,,,,,,,,,,,,,159,,#1,,,,,,,,,[publisher not identified],,,,,,fin,,,,,,,,,,,,,,,,,
2,,,3912459,"Helsinki = Helsingfors : 400 vuotta = 400 år = 400 years, 1951 - 1952",Helsinki = Helsingfors : 400 vuotta = 400 år = 400 years,Eng swe fin,,1951,,,1952,,,,,,,,,,,,,159,,#1,,,,,,,,,[publisher not identified],,,,,,eng,,,,,,,,,,,,,,,,,
2,,,3912463,"Helsinki metropolitan area : Helsinki Espoo Kauniainen Vantaa, 1991",Helsinki metropolitan area : Helsinki Espoo Kauniainen Vantaa,Fin swe,,1991,,,,,,,,,,,,,,,,159,,#1,,,,,,,,,Kaupunkimittausosasto,,,,,,fin,,,,,,,,,,,,,,,,,
2,,,3923719,"Highway map of Mexico = Carta de carreteras de Mexico, 1954",Highway map of Mexico = Carta de carreteras de Mexico,eng spa,,1954,,,,,,,,,,,,,,,,168,,#1,,,,,,Map of Mexico,,,H.M. Gousha Co.,,,,,,eng,,,,,,,,,,,,,,,,,
2,,,3923720,"Highway map of Mexico = Carta de carreteras de Mexico, 1956",Highway map of Mexico = Carta de carreteras de Mexico,eng spa,,1956,,,,,,,,,,,,,,,,168,,#1,,,,,,Map of Mexico,,,H.M. Gousha Co.,,,,,,eng,,,,,,,,,,,,,,,,,
2,,,3923733,"Highway map of Mexico = Carta de carreteras de Mexico, 1956",Highway map of Mexico = Carta de carreteras de Mexico,eng spa,,1956,,,,,,,,,,,,,,,,169,,#1,,,,,,Highways in Mexico = Caminos de Mexico,,,H.M. Gousha Co.,,,,,,eng,,,,,,,,,,,,,,,,,
2,,,3913126,"Highway map of Québec = Carte routière du Québec, 1947",Highway map of Québec = Carte routière du Québec,eng fre,,1947,,,,,,,,,,,,,,,,163,,#1,,,,,,Shell map of Quebec,,,H.M. Gousha Co.,,,,,,eng,,,,,,,,,,,,,,,,,
2,,,3913131,"Highway map of Québec = Carte routière du Québec ; Maritime Provinces = Provinces Maritimes, 1950",Highway map of Québec = Carte routière du Québec ; Maritime Provinces = Provinces Maritimes,eng fre,,1950,,,,,,,,,,,,,,,,163,,#1,,,,,,Shell map of Quebec and Maritime Provinces,,,H.M. Gousha Co.,,,,,,eng,,,,,,,,,,,,,,,,,
2,,,3913132,"Highway map of Québec = Carte routière du Québec ; Maritime Provinces = Provinces Maritimes, [between 1950 and 1959?]",Highway map of Québec = Carte routière du Québec ; Maritime Provinces = Provinces Maritimes,eng fre,[between 1950 and 1959?],,,,,,,,,,,,,,,,,163,,#1,,,,,,Quebec,,,H.M. Gousha Co.,,,,,,eng,,,,,,,,,,,,,,,,,
2,,,3912593,"Im Zentrum von Bern = Au centre de Berne = In the centre of Berne, 1981",Im Zentrum von Bern =  Au centre de Berne = In the centre of Berne,Ger fre eng,,1981,,,,,,,,,,,,,,,,234,,#1,,,,,,,,,Kantonalbank von Bern,,,,,,ger,,,,,,,,,,,,,,,,,
2,,,3912932,"Indien (India ; Inde), 1985",Indien (India ; Inde),eng ger fre,,1985,,,,,,,,,,,,,,,,238,,#1,,,,,,Hildebrand's travel map India,,,Karto-i-Grafik Verlagsgesellschaft mbH,,,,,,eng,,,,,,,,,,,,,,,,,
2,,,3912303,"Ireland, 1966",Ireland,Eng fre ger,,1966,,,,,,,,,,,,,,,,232,,#1,,,,,,Map Ireland = Irland = Irlande,,,Bord Failte = Irish Tourist Board,,,,,,eng,,,,,,,,,,,,,,,,,
2,,,3911931,"Island of Guam highway map, 1982",Island of Guam highway map,eng jpn,,1982,,,,,,,,,,,,,,,,238,,#1,,,,,,Island of Guam highway map = グアム島 ハイウェイ マップ,,,Guam Visitors Bureau,,,,,,eng,,,,,,,,,,,,,,,,,
2,,,3912748,"Italia carta stradale edizione Shell fuori commercio, 1964",Italia carta stradale edizione Shell fuori commercio,eng fre ger ita,,1964,,,,,,,,,,,,,,,,236,,#1,,,,,,Italia carta stradale,,,Shell ; Istituto Geografico de Agostini,,,,,,ita,,,,,,,,,,,,,,,,,
2,,,3912888,"Jan Jan's map of Kowloon 版珍珍圖全龍九文英中, 1960",Jan Jan's map of Kowloon 版珍珍圖全龍九文英中,Eng chi,,1960,,,,,,,,,,,,,,,,161,,#1,,,,,,Jan Jan's map of Kowloon with index,,,Drawn by Chan King Hon ; revised by Wong Chok Sun,,,,,,eng,,,,,,,,,,,,,,,,,
2,,,3912954,"Johannesburg, 1981",Johannesburg,Eng dut,,1981,,,,,,,,,,,,,,,,161,,#1,,,,,,Johannesburg Central-Sentraal,,,Map Studio,,,,,,eng,,,,,,,,,,,,,,,,,
2,,,3912328,"Kaart van Nederland = Map of the Netherlands = Carte des pays-Bas, [between 1940 and 1949?]",Kaart van Nederland = Map of the Netherlands = Carte des pays-Bas,dut eng fre,[between 1940 and 1949?],,,,,,,,,,,,,,,,,158,,#1,,,,,,Kaart van Nederland ,,,Netherlands National Tourist Office,,,,,,dut,,,,,,,,,,,,,,,,,
2,,,3912329,"Kaart van Nederland = Map of the Netherlands = Carte des pays-Bas, [between 1960 and 1969?]",Kaart van Nederland = Map of the Netherlands = Carte des pays-Bas,dut eng fre,[between 1960 and 1969?],,,,,,,,,,,,,,,,,158,,#1,,,,,,Kaart van Nederland,,,Netherlands National Tourist Office,,,,,,dut,,,,,,,,,,,,,,,,,
2,,,3912437,"Karta över Jönköping Huskvarna = Map of Jönköping Huskvarna = Plan de Jönköping Huskvarna = Plan von Jönköping Huskvarna, [between 1980 and 1989?]",Karta över Jönköping Huskvarna = Map of Jönköping Huskvarna = Plan de Jönköping Huskvarna = Plan von Jönköping Huskvarna,Swe eng ger,[between 1980 and 1989?],,,,,,,,,,,,,,,,,159,,#1,,,,,,,,,Tryckeri AB Småland,,,,,,swe,,,,,,,,,,,,,,,,,
2,,,3912867,"Kerkyra (Corfou), 1970",Kerkyra (Corfou),Gre eng ger fre,,1970,,,,,,,,,,,,,,,,237,,#1,,,,,,Kerkyra Corfou ,,,Alma Publications ; Αλεξανδροσ Ματσουκησ [Alexandros Matsoukis],,,,,,gre,,,,,,,,,,,,,,,,,
2,,,3912868,"Kriti, 1971",Kriti,Gre eng fre ger,,1971,,,,,,,,,,,,,,,,237,,#1,,,,,,Tourist map Kriti,,,Chr. Mathioulakis Publication,,,,,,gre,,,,,,,,,,,,,,,,,
2,,,3923660,"Kuba = Cuba, 1994",Kuba = Cuba,eng fre ger ita,,1994,,,,,,,,,,,,,,,,229,,#1,,,,,,Kuba = Cuba,,,Freytag-Berndt u. Artaria,,,,,,ger,,,,,,,,,,,,,,,,,
2,,,3912979,"L'Anse aux Meadows National Historic Park = Parc historique national de L'Anse-aux-Meadows, 1988",L'Anse aux Meadows National Historic Park = Parc historique national de L'Anse-aux-Meadows,eng fre,,1988,,,,,,,,,,,,,,,,162,,#1,,,,,,L'Anse aux Meadows national historic park Newfoundland = L'anse-aux-Meadows parc historique national Terre-Neuve,,,Canada. Minister of Supply and Services Canada,,,,,,eng,,,,,,,,,,,,,,,,,
2,,,3913206,"Le centre de Montréal = the heart of Montréal, 1960",Le centre de Montréal = the heart of Montréal,eng fre,,1960,,,,,,,,,,,,,,,,163,,#1,,,,,,Montréal carte touristique = Montréal tourist map,,,Economic and Tourist Developmental Bureau of the City of Montreal,,,,,,fre,,,,,,,,,,,,,,,,,
2,,,3913208,"Le centre de Montréal = the heart of Montréal, [between 1960 and 1969?]",Le centre de Montréal = the heart of Montréal,eng fre,[between 1960 and 1969?],,,,,,,,,,,,,,,,,163,,#1,,,,,,Carte touristique Montréal = Montréal tourist map,,,Economic Developmental Bureau of the City of Montreal,,,,,,fre,,,,,,,,,,,,,,,,,
2,,,3913240,"Lignes d'autobus de la Commission de Transport de Montréal = Montréal Transportation Commission bus routes, 1960",Lignes d'autobus de la Commission de Transport de Montréal = Montréal Transportation Commission bus routes,eng fre,,1960,,,,,,,,,,,,,,,,226,,#1,,,,,,Carte des lignes = Route Map,,,Montreal Transportation Commission,,,,,,fre,,,,,,,,,,,,,,,,,
2,,,3912334,"Limburg, [between 1960 and 1969?]",Limburg,dut fre eng ger,[between 1960 and 1969?],,,,,,,,,,,,,,,,,158,,#1,,,,,,VVV Provinciekaart Limburg,,,N.V. Illustra,,,,,,dut,,,,,,,,,,,,,,,,,
2,,,3912734,"Lisboa : planta = Lisboa : plan = Lisboa : map, [between 1970 and 1979?]",Lisboa : planta = Lisboa : plan = Lisboa : map,Eng ger spa fre,[between 1970 and 1979?],,,,,,,,,,,,,,,,,236,,#1,,,,,,Lisboa : planta = Lisboa : plan = Lisboa : town map = Lisboa : Stadtplan,,,Hallwag,,,,,,ita,,,,,,,,,,,,,,,,,
2,,,3912855,"Ljubljana, 1972",Ljubljana,Slv fre ita eng tur,,1972,,,,,,,,,,,,,,,,161,,#1,,,,,,,,,Turistični Informacijski Biro,,,,,,slv,,,,,,,,,,,,,,,,,
2,,,3912088,"London, [between 1970 and 1979]",London,Eng fre ger,[between 1970 and 1979],,,,,,,,,,,,,,,,,156,,#1,,,,,,London map,,,Geographia Ltd.,,,,,,eng,,,,,,,,,,,,,,,,,
2,,,3912089,"London, [between 1970 and 1979]",London,Eng fre ger,[between 1970 and 1979],,,,,,,,,,,,,,,,,156,,#1,,,,,,London map,,,Geographia Ltd.,,,,,,eng,,,,,,,,,,,,,,,,,
2,,,3913207,"Lovell's map of Montreal and vicinity, [between 1960 and 1969?]",Lovell's map of Montreal and vicinity,eng fre,[between 1960 and 1969?],,,,,,,,,,,,,,,,,226,,#1,,,,,,Map of Montreal = Carte de Montréal,,,"John Lovell & Son, Limited",,,,,,eng,,,,,,,,,,,,,,,,,
2,,,3913239,"Lovell's map of Montreal and vicinity, [between 1960 and 1969?]",Lovell's map of Montreal and vicinity,eng fre,[between 1960 and 1969?],,,,,,,,,,,,,,,,,226,,#1,,,,,,Map of Montreal = Carte de Montréal,,,"John Lovell & Son, Limited",,,,,,eng,,,,,,,,,,,,,,,,,
2,,,3913293,"Lovell's map of St. Lambert and Longueuil including Greenfield Park Mackayville Jacques Cartier Montreal South Lemoyne Preville, [between 1950 and 1959?]",Lovell's map of St. Lambert and Longueuil including Greenfield Park Mackayville Jacques Cartier Montreal South Lemoyne Preville,eng fre,[between 1950 and 1959?],,,,,,,,,,,,,,,,,164,,#1,,,,,,St. Lambert and Longueuil Lovell's arrow map and street index,,,"John Lovell & Son, Limited",,,,,,eng,,,,,,,,,,,,,,,,,
2,,,3912605,"Lucerne Suisse = Lucerne Schweiz = Lucerne Switzerland, 1958",Lucerne Suisse = Lucerne Schweiz = Lucerne Switzerland,Ger fre eng,,1958,,,,,,,,,,,,,,,,160,,#1,,,,,,,,,[publisher not identified],,,,,,ger,,,,,,,,,,,,,,,,,
2,,,3912606,"Luzern, 1974",Luzern,Ger eng,,1974,,,,,,,,,,,,,,,,160,,#1,,,,,,Plan der Stadt Luzern = Map of Lucerne,,,Kümmerly + Frey,,,,,,ger,,,,,,,,,,,,,,,,,
2,,,3912714,"Madrid : visita de la ciudad = Madrid : visite de la ville = Madrid : city sightseeing, 1962",Madrid : visita de la ciudad = Madrid : visite de la ville = Madrid : city sightseeing,Spa fre eng,,1962,,,,,,,,,,,,,,,,160,,#1,,,,,,,,,A.L.G.,,,,,,spa,,,,,,,,,,,,,,,,,
2,,,3912715,"Madrid : visita de la ciudad = Madrid : visite de la ville = Madrid : city sightseeing, 1962",Madrid : visita de la ciudad = Madrid : visite de la ville = Madrid : city sightseeing,Spa fre eng,,1962,,,,,,,,,,,,,,,,160,,#1,,,,,,,,,A.L.G.,,,,,,spa,,,,,,,,,,,,,,,,,
2,,,3912340,"Map Amsterdam = Stadtplan Amsterdam = Plan de la ville Amsterdam, [between 1960 and 1969?]",Map Amsterdam = Stadtplan Amsterdam = Plan de la ville Amsterdam,eng ger fre,[between 1960 and 1969?],,,,,,,,,,,,,,,,,158,,#1,,,,,,,,,V.V.V. Amsterdam,,,,,,eng,,,,,,,,,,,,,,,,,
2,,,3913192,"Map of greater Montreal Quebec, [between 1950 and 1959?]",Map of greater Montreal Quebec,eng fre,[between 1950 and 1959?],,,,,,,,,,,,,,,,,163,,#1,,,,,,Map of greater Montréal Québec = Carte de Montréal et la banlieue Québec,,,Map Corporation of America,,,,,,eng,,,,,,,,,,,,,,,,,
2,,,3913202,"Map of greater Montreal Quebec, [1957?]",Map of greater Montreal Quebec,eng fre,[1957?],,,,,,,,,,,,,,,,,163,,#1,,,,,,Map and directory of information greater Montreal Quebec with indexed streets = Carte et le guide du renseignement Montreal Quebec avec un index des rues,,,Map Corporation of America,,,,,,eng,,,,,,,,,,,,,,,,,
2,,,3913212,"Map of Greater Montreal Quebec, [between 1960 and 1969?]",Map of greater Montreal Quebec,eng fre,[between 1960 and 1969?],,,,,,,,,,,,,,,,,163,,#1,,,,,,Map and directory of information greater Montreal Quebec with indexed streets = Carte et le guide du renseignement Montreal Quebec avec un index des rues,,,Map Corporation of America,,,,,,eng,,,,,,,,,,,,,,,,,
2,,,3913210,"Map of greater Montreal Quebec, [between 1960 and 1969?]",Map of Greater Montreal Quebec,eng fre,[between 1960 and 1969?],,,,,,,,,,,,,,,,,163,,#1,,,,,,Map of Greater Montréal Québec = Carte de Montréal et la banlieue Québec,,,Map Corporation of America,,,,,,eng,,,,,,,,,,,,,,,,,
2,,,3912892,"Map of Japan = Carte du Japon = Mapa del Japón = Karte von Japan = Mapa do Japão, [between 1960 andf 1965?]",Map of Japan = Carte du Japon = Mapa del Japón = Karte von Japan = Mapa do Japão,Eng fre spa ger por,[between 1960 andf 1965?],,,,,,,,,,,,,,,,,161,,#1,,,,,,Map of Japan = Carte du Japon = Mapa del Japón = Karte von Japan = Mapa do Japão,,,Japan National Tourist Organization,,,,,,eng,,,,,,,,,,,,,,,,,
2,,,3913183,"Map of the city of Montreal and suburbs, [between 1920 and 1929?]",Map of the city of Montreal and suburbs,eng fre,[between 1920 and 1929?],,,,,,,,,,,,,,,,,163,,#1,,,,,,MacFarlane's map of Montreal Que. and suburbs with street index,,,W.G. MacFarlane,,,,,,fre,,,,,,,,,,,,,,,,,
2,,,3913181,"Map of the city of Montreal and suburbs, [between 1920 and 1929?]",Map of the city of Montreal and suburbs,eng fre,[between 1920 and 1929?],,,,,,,,,,,,,,,,,163,,#1,,,,,,MacFarlane's map of Montreal Que. and suburbs with street index,,,W.G. MacFarlane,,,,,,fre,,,,,,,,,,,,,,,,,
2,,,3913182,"Map of the city of Montreal and suburbs, [between 1920 and 1929?]",Map of the city of Montreal and suburbs,eng fre,[between 1920 and 1929?],,,,,,,,,,,,,,,,,163,,#1,,,,,,Street map of Montreal with street index,,,American Autochrome Co.,,,,,,fre,,,,,,,,,,,,,,,,,
2,,,3912906,"Map of the Fuji-Hakone National Park, 1974",Map of the Fuji-Hakone National Park,Eng jpn,,1974,,,,,,,,,,,,,,,,161,,#1,,,,,,,,,[publisher not identified],,,,,,eng,,,,,,,,,,,,,,,,,
2,,,3912327,"Map of the Netherlands = Karte der Niederlande = Carte des pays-Bas, [between 1950 and 1959?]",Map of the Netherlands = Karte der Niederlande = Carte des pays-Bas,eng ger fre,[between 1950 and 1959?],,,,,,,,,,,,,,,,,232,,#1,,,,,,Map of the Netherlands,,,Official Tourist Information Office for the Netherlands,,,,,,eng,,,,,,,,,,,,,,,,,
2,,,3923639,"Mapa de la Republica Dominicana ; Carte de la republique d'Haiti, [between 1948 and 1950?]",Mapa de la Republica Dominicana ; Carte de la republique d'Haiti,spa fre,[between 1948 and 1950?],,,,,,,,,,,,,,,,,168,,#1,,,,,,Mapa de la Republica Dominicana,,,General Drafting Company,,,,,,spa,,,,,,,,,,,,,,,,,
2,,,3923646,"Mapa de la Republica Dominicana ; Carte de la republique d'Haiti, [between 1940 and 1949?]",Mapa de la Republica Dominicana ; Carte de la republique d'Haiti,spa fre,[between 1940 and 1949?],,,,,,,,,,,,,,,,,168,,#1,,,,,,Mapa de la Republica Dominicana,,,General Drafting Company,,,,,,spa,,,,,,,,,,,,,,,,,
2,,,3923754,"Mapa de La Republica Mexicana, 1960",Mapa de La Republica Mexicana,eng spa,,1960,,,,,,,,,,,,,,,,169,,#1,,,,,,Street map of Mexico City with street index = Mapa de la Cuidad de Mexico conindices de calles,,,Map Corporation of America,,,,,,eng,,,,,,,,,,,,,,,,,
2,,,3913056,"Maritime Provinces ; Québec, 1966",Maritime Provinces ; Québec,eng fre,,1966,,,,,,,,,,,,,,,,162,,#1,,,,,,Quebec and Maritime Provinces,,,H.M. Gousha Co.,,,,,,eng,,,,,,,,,,,,,,,,,
2,,,3913059,"Maritime Provinces ; Quebec, 1967",Maritime Provinces ; Québec,eng fre,,1967,,,,,,,,,,,,,,,,162,,#1,,,,,,Quebec and Maritime Provinces,,,H.M. Gousha Co.,,,,,,eng,,,,,,,,,,,,,,,,,
2,,,3913058,"Maritime Provinces ; Québec, 1972",Maritime Provinces ; Québec,eng fre,,1972,,,,,,,,,,,,,,,,162,,#1,,,,,,Quebec and Maritime Provinces,,,H.M. Gousha Co.,,,,,,eng,,,,,,,,,,,,,,,,,
2,,,3913185,"Metropolitan map district of Montréal = Carte métropolitaine district de Montréal, [1938?]",Metropolitan map district of Montréal = Carte métropolitaine district de Montréal,eng fre,[1938?],,,,,,,,,,,,,,,,,163,,#1,,,,,,Shell road map metropolitan Montreal,,,H.M. Gousha Co.,,,,,,eng,,,,,,,,,,,,,,,,,
